source,review_id,user_name,review_title,review_description,rating,thumbs_up,review_date,developer_response,developer_response_date,appVersion,laguage_code,country_code
Google Play,87760f24-9b78-4caf-a5b7-35f71d032abb,Ranjit patil,,Fake falatu apps Driver call coming on front and say cancel trip and give me same amount and ola charge canceled amount change pollicy cancelation charge apply on driver,1,0.0,2022-10-28 00:05:43,"We're upset by the troublesome experience you had with us, Ranjit. Please share the CRN of these instances with us at (m.me/olacabs) so that our team can assist you further.
",2022-11-17 08:52:52,5.7.5,en,in
Google Play,65b7c8ff-cc77-4bca-b23f-421070adc288,SAMADHAN SONKAMBLE,,I was given 5 star but I was wrong u don't deserve even 1 star. Without any reason my account blocked may be because of I was rate u 1 star? Very pathetic ethics,1,1.0,2022-08-05 06:45:31,"We are here to help you, Samadhan. Could you please share your registered contact details with us via m.me/olacabs so that we can look into it and assist you accordingly?",2022-08-29 08:53:35,5.7.3,en,in
Google Play,d77765f7-2ca2-4eb7-ba05-4c7ee259b962,sur Nakka,,Very bad experience on 30th November I booked ola auto on that I paid amount by cash but still showing in my app amount is pending. And I am unable to ride to onther cab...,1,0.0,2021-12-09 15:24:06,"This doesn't seem right. We want to take a closer look at this for you. Kindly share your concern along with the CRN of the ride via (m.me/olacabs) for us to investigate and assist you at the earliest.
",2021-12-10 13:00:45,5.5.7,en,in
Google Play,e8789cb4-f09b-4960-8acb-31ce1de3e707,nishita maruvada,,I could not login into the app can you please check it,1,0.0,2021-01-06 01:03:27,,,5.3.5,en,in
Google Play,263f18da-392e-4f5f-90df-a61d44dade0b,Muhammad Touseef Ali,,Pathetic service. You charge your customers even if your drivers cancel a trip,1,0.0,2020-08-15 11:24:08,,,5.2.3,en,in
Google Play,d8cb212b-563a-44ff-8de3-973240bcfd1c,A Google user,,Ola service is very very worst... Driver behavior was too poor and speech is worst...,1,0.0,2018-09-13 15:04:49,,,4.6.2,en,in
Google Play,8a69c35c-ec1b-4ec6-91ab-3422d6a43eb1,Shreya Palit,,Totally frustrated with the app. After booking if I'm trying to call the driver.. there are not allowing for the same. Even they are not contacting to us. Cab is irresponsible and always make us late. So finally going to uninstall it.,1,0.0,2023-07-23 14:45:26,"This doesn't seem right, Shreya. We want to take a closer look at this for you. Kindly share your registered contact details and an active email address via (m.me/olacabs) for us to investigate and assist you at the earliest.",2023-07-23 23:59:40,6.2.7,en,in
Google Play,dc626b47-807d-45af-8309-54aaaa8ea3d9,A Google user,,Very bad application...... I m not login in my device. Very bad. Rapido is the best in market,1,0.0,2019-10-05 04:50:53,,,4.9.9,en,in
Google Play,60e636e9-9b02-4238-bb46-74e4d564ffda,Joy Prince Lobo,,"Deserves a negative star. Worst app, worst customer service and changes fare after reaching destination. Hiking actual fares by giving irrelevant reasons like traffic and wait time.",1,0.0,2022-11-15 09:03:27,"We understand your concern and are here to make things right for you, Joy. Could you please provide us the CRN details of this ride via m.me/olacabs so that our team can look into this and assist you aptly.",2022-11-27 02:16:16,,en,in
Google Play,dfa21eb0-ee0b-4f16-9d8c-c65d13654120,A Google user,,"After the new update, I'm not able to use any voucher/coupon codes. Not even one. It's not telling the reason why and when I apply it, it says it's been applied but then it's gone. It just vanishes and it's back to never being applied. It's annoying. Why would you send codes everyday and not let me use it. It's frustrating. Can you please fix it? Fix the promo code application. Not able to enter at all!!!",1,2.0,2018-10-12 01:57:08,,,4.7.2,en,in
Google Play,ad749639-6f61-49e2-9e46-e5ae60ce22af,Gpk.viswanadham 8332977701,,Very bad my time weast,1,0.0,2020-08-03 11:15:02,,,5.2.2,en,in
Google Play,441976be-9808-468c-8230-ab35a29b70ca,A Google user,,Too slow worst app,1,0.0,2019-10-20 02:48:25,,,5.0.1,en,in
Google Play,84cda6f8-111f-4e8c-8b6d-83392ceab91b,A Google user,,bkvas app h. inke driver khud hi booking cancel kar dete h or 50 rs panelty cusromer ko laga dete h. chor h sale bhikh hi maang lo,1,0.0,2019-03-05 11:04:38,,,4.8.2,en,in
Google Play,45ffadbe-825d-4d49-a641-9e56e164a62c,A Google user,,Worst service from ola.👎,1,0.0,2018-06-26 18:44:28,,,4.6.3,en,in
Google Play,032cbe7b-a2d8-4194-8b50-86013de59b80,A Google user,,"at the time, Not book hate it app",1,0.0,2018-06-08 03:58:28,,,4.6.2,en,in
Google Play,7b6efa72-77d7-4959-980b-4aa530f136fb,no name,,"No straight forward way to register a complaint. The main support page always shows technical error. The drivers keep cancelling the rides, seems no consequences for drivers. Oh, and too many notifications and ads.",1,0.0,2023-01-02 04:17:14,"We understand your displeasure. This seems to be a technical glitch. Please try re-installing the app and check if it works. If the issue persists, kindly write to us at (m.me/olacabs) and we will reach out to you for further assistance.
",2023-01-10 18:09:58,4.9.4,en,in
Google Play,7c91ebe1-67e6-4df9-8a0c-d1376aa27995,thasleema nasrin,,very worst app. no proper response from driver r from the ola team. I have booked for auto he said me to wait for 10mins but for past half hour i am waiting. there is no response from the auto driver. He is asking me to cancel and if i cancel the cancellation charge is charged rs.15. for what purpose i should pay rs.15 for ola ? . Either of the auto drivers charges extra for drop r they wont be a proper response i am not going to cancel the trip. the service is so poor.,1,4.0,2020-05-02 13:31:14,,,5.1.5,en,in
Google Play,35a4bb47-b03b-49c5-a6df-5a2a995166dc,Lehar Kaushik,,"Worst App I have ever used Took ride and amount was Rs 157, but ola driver did not complete the ride after drop and accept another ride from different app and after 2.45 hr when I called driver then he marked it as completed. Now Ola is charging me Rs 291 extra (total 448) as their driver partner is lying to save himself. Your policies are garbage if you are not able to use your brain to decide who is telling the truth and losing old customers. And Ola CC service are worst never call them.",1,0.0,2023-03-20 03:02:58,"We're upset by the troublesome experience you had with us, Kaushik. Please share the CRN of these instances with us at (m.me/olacabs) so that our team can assist you further.",2023-03-28 18:45:07,,en,in
Google Play,f4373ef9-d6c2-4282-bf60-aadbdef64f29,Sandeep Chhabra,,Please check the email thread... Pathetic customer service.,1,0.0,2021-06-22 00:20:31,"This is certainly not the impression we want you to have of us, Sandeep. Request you to elaborate on your issue at (m.me/olacabs) so that our team can have a better understanding of your problem and assist you promptly.",2021-06-21 21:14:49,5.4.6,en,in
Google Play,1862e68c-af30-4785-84c2-d53fb87b9ad0,A Google user,,Worst app becoz their driver saying to cancel the trip and then we will pick up personally on their demand and asking extras money their customer care also not helping and not picking up any calls.So plzz do not install this app.,1,0.0,2020-02-05 06:34:06,,,,en,in
Google Play,e324b478-de45-44e7-bdaa-0d1071d86019,Pasalapudi Syam,,Installlation problem,1,0.0,2020-07-12 14:40:33,,,,en,in
Google Play,2e589284-70d9-41a6-96be-66ef803c6b01,ajay Kattupalli,,Bit avaible cavs at morning time and shodule book asali waste of money no cabs r avaible,1,0.0,2022-04-29 15:52:03,"Your review is concerning for us, Ajay. We're here to assist you in the best way. Kindly elaborate on your concern via (m.me/olacabs) for us to understand and assist you at the earliest.
",2022-05-03 03:19:21,5.6.7,en,in
Google Play,693f90e9-ee0e-4046-ae2d-d06bdb636909,Neelabjo Mondal,,"All the drivers have began asking about the drop locations and the fare amount, before the pick-up. They decline online payments and accept only cash. Then they cancel the ride as per their damn wish. Incredibly pathetic experiences when using Ola.",1,2.0,2021-11-24 06:07:03,"Your review is concerning to us and we appreciate you bringing this to our notice, Neelabjo. We have stringent guidelines against such unprofessional behaviour. Request you to share the CRN of the ride at (m.me/olacabs) so we can take corrective action against the driver-partner and curb such instances.
",2021-11-25 21:28:42,5.5.7,en,in
Google Play,ca6bce88-f66a-4f71-b55c-5658a6547d41,Pintu Sengupta,,"They have been turned into cheaters. No ac in the cab, but charging price for AC. Drivers keep refusing rides and canceling it, but no action from Ola.",1,0.0,2022-03-24 03:33:30,"Hello, Pintu. This is absolutely not the kind of experience we would like our customers to face. Kindly share the CRN via (m.me/olacabs) for us to investigate and take timely action against the driver-partner to ensure such instances are not repeated in the future.
",2022-03-26 00:38:42,5.5.8,en,in
Google Play,abbe8a30-c759-4888-8a27-b0352e24337b,Rinku Mishra,,I had paid to driver in cash but they had detect from my ola money account and again and again call aur massage and tell pay tha balance whay i will again..... Ola is very fraud company plzz not to download or not to take ride.,1,0.0,2022-12-01 05:20:58,"We understand your displeasure and are here to address your concern, Rinku. Please share the CRN details of such instances via (m.me/olacabs) so that we can look into this and assist you further.",2022-12-02 02:05:46,5.7.9,en,in
Google Play,56612dea-3864-4f32-a667-2c223885c91f,naveen kumar,,"Even after paying through cash, money is taken through my ola money postpaid wallet and no refund is being issued even after requesting. Worst service and inettiquette driver.",1,0.0,2023-01-08 04:50:45,"We’re upset by the experience you’re facing with us, Naveen. Kindly share the CRN of the ride via (m.me/olacabs) for us to investigate and assist you at the earliest.",2023-01-02 00:28:22,5.8.1,en,in
Google Play,51a6b212-c98a-40d8-b09e-0e59acdf0b32,Komal Kaur,,Waste of time for me,1,0.0,2022-05-06 11:48:07,"Customer satisfaction is of utmost importance to us and we at Ola strive for it, Komal. We request you to elaborate on your concern at (m.me/olacabs) so that our team can investigate further and resolve it.",2022-05-11 06:25:54,,en,in
Google Play,b270430d-da69-4e20-b338-4a9afcd663bb,Dattatray Gudala,,Very bad taxi rule Start amount is different end amount is very high amount,1,1.0,2022-01-21 11:24:48,"Customer satisfaction is of utmost importance to us and we at Ola strive for it, Dattatray. Request you to elaborate on your concern at (m.me/olacabs) so that our team can investigate further and resolve it.
",2022-01-21 17:15:50,5.5.9,en,in
Google Play,94b4460f-6bc8-4b9b-b853-d93bfdbb34d5,A Google user,,Unable to book ola,1,0.0,2019-12-28 12:19:30,,,5.0.4,en,in
Google Play,a286cf84-2179-4c9b-9949-97f735ac90cd,Vikas Rana,,"Pathetic services, every time driver cancel the ride and no problem resolution platform available for customers.",1,0.0,2021-10-23 11:07:20,"Customer satisfaction is of utmost importance to us and we at Ola strive for it, Vikas. We request you to elaborate on your concern at (m.me/olacabs) so that our team can investigate further and resolve it.",2021-10-24 13:32:30,5.5.5,en,in
Google Play,708f41b9-a7b1-492d-85d6-4f17bf9ae94e,A Google user,,I had worst experience yesterday with Ola. Just because of their driver I missed my train. I reported that to customer support but not getting any reply from them. Worst app and customer support team.,1,0.0,2019-09-19 09:41:30,,,,en,in
Google Play,67b86ef0-4a9f-4cb5-97d2-3e0f1c78abfc,Kanhaiya Agrawal,,Most worsted ola app I can't Believe ola in patna driver bad behaviour with coustour Golu kumar 6925 car no Swift dizire drive सोम बेहंचोद ड्राइवर ऑफ पटना ओला कैब,1,0.0,2021-08-27 14:43:03,,,5.4.9,en,in
Google Play,24a64945-99aa-45b8-b908-004b7ab9ecb3,Vivek Shukla,,You are at the mercy of the driver.,1,0.0,2022-10-14 12:31:52,"Your review is concerning for us, Vivek. We're here to assist you in the best way. Kindly elaborate on your concern via (m.me/olacabs) for us to understand and assist you at the earliest.
",2022-10-27 14:24:46,5.7.5,en,in
Google Play,174ce6b0-a4c2-43e3-b81b-bfc4a4392b06,A Google user,,Ola request us for our feed back. But they never consider our feedback. I successfully uninstalled the Ola App for their disrespect towards the customer. Thanks for your service.,1,0.0,2018-10-02 15:19:57,,,,en,in
Google Play,9f847d2a-6104-40d4-9fe4-6f4dfeb57d4a,A Google user,,nowadays ola is giving very worst service and also hiked the price. especially from new panvel you never get cab on time.Uber service is far better than ola,1,0.0,2019-05-31 08:40:40,,,4.8.9,en,in
Google Play,0caa1ea0-f6dc-4dfa-a7a5-1988e2ab74ac,Sneh lata,,Ola is making customers fool my 07 rides book but all the drivers denied and demanding for more money that rides so pls . Avoid booking through ola...,1,0.0,2022-08-13 10:33:48,"Your review is concerning to us and we appreciate you bringing this to our notice, Sneh. We have stringent guidelines against such unprofessional behaviour. Request you to share the CRN of the ride at (m.me/olacabs) so we can take corrective action against the driver and curb such instances.
",2022-09-06 22:34:13,5.7.3,en,in
Google Play,7289f7d9-4fdf-4a99-ab4e-5c2970be4f8b,A Google user,,satisfactory,1,0.0,2019-02-26 07:08:05,,,4.7.9,en,in
Google Play,1e65161e-ced1-4507-8c3f-e9c903864d35,A Google user,,I have booked an ola but it cancelled automatically when i call the driver he said he is not nearby my location so he cancelled it... I feel angry for this stupid service by ola (chintamani sahu car no. - OD33N0042) WHITE Beat,1,0.0,2018-03-05 00:08:36,,,,en,in
Google Play,e5b00808-b5b7-4302-9e1d-7c11f2b1633d,A Google user,,Extremely poor. I have been receiving a regular reminder from Ola for the past couple of months to pay Rs.217 postpaid amount which I dont owe the company in any way as i always pay through cash after every ride... It is sheer harassment of customers by OLA. So i have decided to discontinue hiring OLA CABS as i find them to be fraudulent in their dealings.,1,0.0,2019-05-05 13:01:36,,,4.1.8,en,in
Google Play,e422d062-ea33-4a36-b36b-50c98b5ea273,Shabana Begum,,Very bad last ride me cash pay kiya tha ab next ride booking k time last pay is due batara hai repay kiye bina next booking nai hosakti kehre hai west aap,1,0.0,2021-10-01 04:01:09,"We understand how upsetting it may have been for you, Shabana. This is definitely not the experience we wanted you to have. Request you to please share the CRN of the ride with us at (m.me/olacabs) so that our team can assist you further.
",2021-10-05 01:48:21,5.5.3,en,in
Google Play,e9d9c327-158a-4e63-9830-c6ca15d5c11c,Shushela Chowdhary,,Take extra charges,1,0.0,2021-07-14 02:15:30,"We are concerned after looking at your review, Shushela. Kindly elaborate your concern at (m.me/olacabs) post which our team will connect with you and assist you further on the same.
",2021-07-15 10:55:06,5.4.8,en,in
Google Play,c308f088-d24f-436e-80c9-039e0cf0fa9f,Arup Sau,,"Many times in Kolkata,the drivers misbehave and they don't turn on the ac despite repeatedly telling them...look into this or ola will lose its business in kolkata",1,0.0,2021-10-27 08:35:20,"We are concerned after looking at your review, Arup. Kindly elaborate on your concern at (m.me/olacabs) post which our team will connect with you and assist you further on the same.
",2021-10-28 18:55:16,5.5.5,en,in
Google Play,d883ceee-d631-4159-a054-76b94ccfaf8d,VIJAYA SARATHI,,Wast app,1,0.0,2021-06-05 03:25:03,"We want to speak to you, Vijaya. We request you to share your concern at (m.me/olacabs) so that our team can assist you further.",2021-06-06 01:41:26,,en,in
Google Play,4b82c554-6d7d-4e65-835d-21296782f7e3,Mohit Kumar,,"Ridiculous services, no customer care contact number provided, drivers accept rides then decline the service at their comfort. Totally harassment.",1,0.0,2023-01-30 13:24:58,"We are concerned after looking at your review, Mohit. Kindly elaborate on your concern at (m.me/olacabs) post which our team will connect with you and assist you further on the same.
",2023-02-04 05:55:41,4.6.1,en,in
Google Play,17a6e631-fd3f-470a-980a-9c39a74527ef,A Google user,,Because of your third class system what i supposed to be you blocked my account permanently widout any reason ..  your app got hanged nd you said its my fault not yours.. i wont recommend your service.. u doesnt care of customer at all...,1,0.0,2018-03-20 21:58:46,,,,en,in
Google Play,b6638eec-a277-4291-bdf8-7f5e9b49e5f8,A Google user,,I've updated ola app and still it tells me to update inorderto get coupons,1,0.0,2018-12-06 16:01:14,,,4.7.5,en,in
Google Play,2bbef94c-46aa-43e8-98f6-7d26a60e319e,A Google user,,Uber is best,1,0.0,2018-03-09 16:48:28,,,,en,in
Google Play,d6b063ed-617c-4e46-88b2-25ed85240fb2,A Google user,,Worst booking app I have ever seen!,1,0.0,2018-06-26 18:15:48,,,4.6.3,en,in
Google Play,1e661a3b-607b-4daf-89b1-ff0ddb17e306,Allada Vikky,,One of the third class service I have ever seen in my life.,1,0.0,2023-06-10 01:37:46,Customer satisfaction is of utmost importance to us and we at Ola strive for it. We request you to elaborate on your concern at (m.me/olacabs) so that our team can investigate further and resolve it.,2023-06-14 10:38:54,6.2.1,en,in
Google Play,de66c765-2014-43e7-9464-dd1c67195bd4,Akshit zzone,,App not run,1,0.0,2023-03-17 05:15:34,"Hi Akshit, this seems to be a technical glitch. Request you to update the application with the latest version. In case the issue still persists, kindly write to us at (m.me/olacabs) for us to check and fix it for you.",2023-03-20 18:15:59,4.9.9,en,in
Google Play,c8990ea6-ed1e-4635-ab43-6c30fea7eec5,ROHIT SINGH,,Worst service. So many glitches which lead to overcharging than the estimated amount.,1,0.0,2022-04-23 15:10:22,"We're upset by the troublesome experience you had with us, Rohit. Don't worry, we're always here to assist you. Kindly write to us at (m.me/olacabs) along with the CRN of the ride for us to investigate and assist you aptly.
",2022-04-26 01:11:26,5.6.6,en,in
Google Play,51d829bc-2798-4d79-83ed-61cb01bf3fb0,history heroes,,Goodbye China,1,0.0,2020-06-08 14:01:38,,,5.1.1,en,in
Google Play,ab121c6a-6d2e-4ad1-b7ca-6918bc00f11b,A Google user,,no god,1,0.0,2018-03-22 10:06:58,,,,en,in
Google Play,cd2e38d1-5b09-4c89-892c-ff63087baff0,Sachin Gotpagar,,nice,1,0.0,2021-07-11 09:34:59,"We are concerned about the 1-star rating and would like to know the reason behind it, Sachin. Kindly elaborate your concern at (m.me/olacabs) post which our team will connect with you and assist you further on the same.
",2021-07-11 12:53:20,5.4.7,en,in
Google Play,cccfe447-9fc5-4058-b235-1574ac4969df,Het Bhatt,,Where can i buy the ola scooter from the app.,1,1.0,2021-09-15 10:24:11,,,5.5.2,en,in
Google Play,d8223ef7-72cc-472b-9f78-5543ec490bd0,A Google user,,Didn't refund money for failed transaction. I have lost ₹2000,1,0.0,2018-12-13 01:59:00,,,4.7.5,en,in
Google Play,1a7bef46-4fea-4948-baf4-59e69cf63fd2,A Google user,,Ola please provide your email or phone no so that i can file my complaint,1,0.0,2019-07-21 15:23:10,,,4.9.3,en,in
Google Play,f3c24336-4ebf-46ab-9ca2-f6f1c20a1b6b,A Google user,,worst app 3rd Class,1,0.0,2018-12-25 14:58:48,,,4.7.7,en,in
Google Play,fe9a0c25-c2c5-4b69-9916-98944cccce7d,Tough Tough,,Waste ola app noobda app,1,0.0,2020-12-31 11:42:37,,,,en,in
Google Play,762aa1e5-46a4-4420-9bd5-4f331f53a0f1,ADITYA RAJ,,"This is THE WORST app. Never works when you need it the most. I had to book a cab for an emergency and it kept asking me OTP, and didn't allow me to enter OTP at the same time. I strongly recommend not to use this POS. YOU BETTER WALK!",1,0.0,2022-03-04 13:40:21,"This seems to be a technical glitch. Do not worry, we're here to assist you, Aditya. Kindly update the application and if the issue still persists, write to us at (m.me/ olacabs) so that we can look into the concern and make things right for you.
",2022-03-10 05:50:28,,en,in
Google Play,98837502-ca4a-4d8e-9041-b4f298d7f0cf,Ankit Bais,,CHORR HAI SAALE YE LOG,1,0.0,2021-02-20 16:34:29,,,5.3.6,en,in
Google Play,c0b13a78-dc3b-4431-8f72-5a14a1e2069e,shubham gupta,,"Don't use this app for cab bookings. They charge very high, they used to take toll taxes even if your cab doesn't cross the borders or tolls. They don't even have a customer support, if you are in trouble or in need to talk to them, there will be no one to whom you can talk. I was charged 201rs for a ride of 7km. Not recommended at all, very expensive I prefer you rather go with uber, there fare is cheaper as compared to it.",1,192.0,2021-09-08 18:30:57,"We're upset by the troublesome experience you had with us. Don't worry, we're always here to assist you, Shubham. Kindly write to us at (m.me/olacabs) along with the CRN of the ride for us to investigate and assist you aptly.
",2021-09-10 18:17:03,5.5.2,en,in
Google Play,6dfdd902-9de1-4b99-b8bb-28a6d5c237bf,P Gatsby,,"Just terrible first ride, the app has very unfriendly UI, it's crummy, I booked a ride for my mom thinking I'd pay online when the ride is at the destination, but no! I couldn't. She had to pay the driver by cash, I couldn't even see what payment method I had used for the ride, they just want you to confirm the ride no matter what! Don't worry about the cancellation so much folks! Focus on providing better user experience.",1,1.0,2021-03-13 14:49:22,,,,en,in
Google Play,50e24e84-6b37-415b-b543-5e1d47a96ac3,A Google user,,somehow i managed to pass through turn on location screen ! fix this bug asap..! it can't fetch location even if gps in on! can't book cab,1,0.0,2019-04-14 06:13:15,,,4.8.5,en,in
Google Play,3ed5c79a-fdcf-4787-b811-310e7d1d2306,gaurav sharma,,"Online payment does not reflect after paying, driver insisted on cash. Double payment made. Very inconvenient.",1,1.0,2020-08-08 08:40:23,,,5.2.3,en,in
Google Play,903d6e63-f7f0-4172-81e0-1f955bb2802e,Muhammed Sheheer99,,What the f...... g App no one thake ride,1,0.0,2021-09-09 14:58:30,"Customer satisfaction is our topmost priority, Sheheer and we never compromise with it. Such behaviour is not encouraged at Ola. Kindly share your concern in brief along with the CRN of the ride at (m.me/olacabs) so our team can help you in the best way.
",2021-09-11 01:02:26,5.5.2,en,in
Google Play,2612296c-f734-401c-81b9-2e123c0965d2,A Google user,,The worst app,1,0.0,2018-04-18 23:02:58,,,4.5.9,en,in
Google Play,97c8606c-1018-4210-a7b1-45156c29e658,A Google user,,auto driver is so arrogant he charged more than agreed amount and his behaviour is worst,1,0.0,2019-07-14 15:24:28,,,4.9.2,en,in
Google Play,ff6d712b-45c1-40e0-ad41-ede018655deb,A Google user,,Cap  driver denied duty and you block my account  Worst app these is totally unfair Unblock my account,1,0.0,2018-02-26 04:41:15,,,,en,in
Google Play,cf804a92-6333-4e5b-899a-3862965dd1ea,A Google user,,Not user friendly,1,0.0,2019-08-29 17:17:27,,,4.9.6,en,in
Google Play,a1e86ffd-e441-45e6-bad8-2f117476cfcc,Shankar Raman,,Worst service. Negative rating should be given. Drivers demand extra money otherwise they ask us to cancel the trip. We booked 4-5 cars and all of them did the demanaded extra money. I missed my train because of this issue.,1,0.0,2022-03-25 21:17:11,"This is definitely not the experience we wanted you to have, Shankar. We have stringent guidelines to monitor ride cancellations. Request you to share the CRN of these instances at (m.me/olacabs) for us to look into this for you.
",2022-03-27 22:23:08,5.6.6,en,in
Google Play,60b2ea3b-866b-43b9-85b1-0bbe95cc82a5,Saurabh Kumar,,Nice app,1,0.0,2021-04-13 07:11:50,,,5.3.9,en,in
Google Play,5cea8957-e694-449e-95a5-0aab9e7731c1,Mohammed Marwan,,Unable to book for people other than myself.,1,0.0,2021-04-18 10:16:36,We definitely don't want our app to not work as intended! Mohammed. Could you share more details by writing to (m.me/olacabs)? Our team will get to work on fixing the issues you faced.,2021-04-19 11:10:54,5.3.9,en,in
Google Play,0bdc0835-cb5a-4f5c-a599-6918e08eb327,Naved Shaikh,,The app crashed Not working properly!,1,0.0,2021-09-06 19:03:34,"Hi Naved, this seems to be a technical glitch. Request you to update the application with the latest version. In case the issue still persists. Kindly write to us at (m.me/olacabs) for us to check and fix it for you.
",2021-09-09 18:15:25,,en,in
Google Play,34f4ec28-bc6e-4236-bcfc-d25bed995121,Raju Reddy,,Ywqa,1,0.0,2021-03-28 08:15:29,,,4.8.4,en,in
Google Play,7ec514a9-29b0-4432-beff-c2ddfbcaac52,A Google user,,worst app. dont use . Actual fare is higher than expected fare.,1,0.0,2019-06-02 05:47:28,,,4.8.4,en,in
Google Play,54231fa6-4694-4515-a39f-5fb3b1f1bfff,manju reddy,,fraud company,1,0.0,2020-10-31 06:22:27,,,4.8.2,en,in
Google Play,c5345a9d-4aaf-460a-a406-04f6ea099928,A Google user,,"Very funny, when I complained for bike captain, you guy took action against him very fast, I thought wow OLA is very responsible company for users. But suddenly my id got blocked without any reason. Keep your monopoly.  I hate ola. I will use Uber. You are not only the company which provides such services.",1,0.0,2019-11-11 21:38:58,,,5.0.1,en,in
