source,review_id,user_name,review_title,review_description,rating,thumbs_up,review_date,developer_response,developer_response_date,appVersion,laguage_code,country_code
Google Play,6e6dc334-371d-41f5-80cf-15d43d5ac155,Aishwarya Srivastava,,Pathetic app and service. Worst quality cabs. Worst driver behaviour. And on top of that worst customer support. Pls use uber or blu cabs or anything but NEVER USE OLA. They will harass you.,1,0.0,2021-10-10 07:22:12,"We are alarmed to hear this and we appreciate you bringing this to our notice, Aishwarya. We have stringent guidelines against such unprofessional behaviour. Request you to share the CRN of the ride at (m.me/olacabs) so we can take corrective action against the driver and will make sure such instances are not repeated.",2021-10-14 01:06:53,4.9.9,en,in
Google Play,9d879849-8bc6-4280-8c40-34eb32ae1d23,A Google user,,Blocked on my device why??? answer me first...,1,0.0,2018-05-25 18:03:36,,,4.6.1,en,in
Google Play,f10537bc-5267-4f4c-b35a-f8d704179a3d,Prasanna lakshmi,,"Just a worst customer care,I have told my problem.regarding the ola post paid transaction and they didnt even reply regarding that since a week...useless and helpless dnt use ola postpaid and ola also.This is not the only app to be there are other best apps to deal with bookings.better to go with those other than this helpless and costly app.dnt want to even give one star bt just to write the comment have to give...In one word useless and worst",1,0.0,2020-11-06 07:37:05,,,5.3.1,en,in
Google Play,3c05acb6-c499-43ec-9735-1e2e59e636e0,Shyma Jathin,,"Payment taken twice. Even though ola postpaid is used, it asks pending payment after each ride and takes payment. In another incident, After cash payment was made for a ride, it asked for online payment. Unable to reach their customer care and no response to mails",1,0.0,2023-05-15 08:20:51,"This is certainly not the experience we want for you, Jathin. Kindly share the CRN of the specific ride via (m.me/olacabs) for us to investigate and assist you aptly.",2023-05-24 05:48:36,6.1.8,en,in
Google Play,6ca06e59-ba90-44aa-bac9-d3719018beec,A Google user,,"The map shows wrong pickup location and ola charges you cancellation 
charges for no fault of yours. There is no support email id or phone number.",1,1.0,2018-07-27 15:44:55,,,4.6.5,en,in
Google Play,b8f50a79-dfe2-4bb3-91a0-2f662b3f314b,ehtesam ece,,Hi @Olacabs your drivers are unprofessional and ridiculous and you charge us even for not traveling No way to reach customer support,1,0.0,2022-07-21 12:47:04,We understand your concern and are here to make things right for you. Could you please provide us the CRN details of this ride via m.me/olacabs so that our team can look into this and assist you aptly?,2022-07-26 17:37:14,5.7.2,en,in
Google Play,dc4dfc5e-fb84-4119-8cd1-9038e48b7ff3,A Google user,,Very bad app it's not responding to my mobile,1,0.0,2018-10-14 00:45:45,,,,en,in
Google Play,5610a6c6-2e57-400b-b871-830bfb04e6a5,Gouthami Praveen Kumar,,"On January 6 .2022,,, I TOOK A RIDE...WHICH WAS ON ONLINE PAYMENT MODE....BUT LATER WHEN MY RIDE IS DONE...NETWORK WAS DOWN,,SO, DRIVER ASKED ME TO PAY IN CASH....SO, I DID...THAT DAY SINCE I GET EVERY HOUR TO CLEAR THE PAYMENT....WHY SHOULD I PAY AGAIN WHEN I ALREADY PAID ....WHY DON'T YOU ASK..OR ...GO THROUGH YOUR DRIVER'S....INSTEAD OF ANNOYING CUSTOMERS....EVEN TO COMPLAINT ABOUT THIS ISSUE THERE IS NO CUSTOMER SERVICE TO SOLVE IT..OR ..TO SUPPORT.. #WORSTSERVICE #OLACABS",1,0.0,2022-02-11 13:03:23,,,5.6.3,en,in
Google Play,2d1ac37b-a080-4f3e-bf7d-e3778f31e959,sagay S,,Wrost service in emergency time always the drivers cancel the ride and make the customer trouble,1,0.0,2021-09-16 15:44:27,"We never aim for such a kind of experience. We wouldn't want you to feel this way. Kindly elaborate your concern at (m.me/olacabs) for us to check and assist you in a timely fashion.
",2021-09-16 20:29:59,,en,in
Google Play,814f03bd-caee-414a-bcb8-f07804c45be5,mumbai local,,Customer service number not available my payment had done twice not received yet,1,0.0,2022-07-29 10:03:41,"We're saddened by the troublesome experience you had with us. Don't worry, we're always here to assist you. Kindly write to us at (m.me/olacabs) along with the CRN of the ride for us to investigate and assist you aptly.
",2022-08-20 14:46:32,5.7.2,en,in
Google Play,e4491213-fac2-461a-b352-56d9a5bdda08,Gouranga Dutta,,Drivers are asking extra money for AC. There is no control from the company.,1,0.0,2022-03-30 07:54:45,"Customer satisfaction is of utmost importance to us and we at Ola strive for it, Gouranga. Request you to elaborate on your concern at (m.me/olacabs) so that our team can investigate further and resolve it.
",2022-04-03 09:29:02,5.5.9,en,in
Google Play,acd3233b-291a-4ec5-bb42-d748e06b6822,SHREYA CHAKRABORTY,,so much expensive for me,1,0.0,2021-12-10 05:00:02,,,5.5.2,en,in
Google Play,474bd340-b438-4b0f-a090-e05cb80988a7,A Google user,,"The price they commit is always less than competitor, but they charge always higher than their competitors. Nice business model. Because of your incentive structure on 7,14,21 rides, no cab driver choses to go for long hop. And then get a call stating Customer has requested cancellation. Your business model sucks. I will rather be uninstalling the app than being disappointed.",1,5.0,2019-09-07 05:25:38,,,4.9.6,en,in
Google Play,080d68f1-3a2c-4a9c-9901-432fac0c242e,Syed Umaiz Ulla,,Ola outstation is an scam recently I booked can at the time of booking it showed me 1454 but at the of trip I was charged 2200+ ola scammed me 800 which is completely not acceptable as I didn't exceed my limit nothing wen I tried to call customer support they dint help me out I was info that what I have charged it's final and they cannot help me out anyway I would request you all to be careful don't get fooled ola scammed me 800 which is not acceptable thumbs down,1,0.0,2020-10-02 12:27:31,,,5.2.6,en,in
Google Play,5aaf94ef-4948-423b-a02a-26d79a971054,sagar namjoshi,,Very poor response. Driver's cancelling from their end. Very slow too. Very unprofessional.,1,0.0,2022-09-13 14:05:35,"We're upset by the troublesome experience you had with us, Sagar. Please share the CRN of these instances with us at (m.me/olacabs) so that our team can assist you further.",2022-09-25 11:00:08,5.7.4,en,in
Google Play,a1c88baf-a873-4537-aee9-3b95a6191ef1,Nilesh Tawade,,Fraud,1,0.0,2021-11-25 04:07:22,"This kind of review makes us super sad, Nilesh. We want to know the reason behind your dismay. Kindly elaborate on your concern via (m.me/olacabs) for us to understand and assist you in the best way.
",2021-11-26 17:17:20,5.4.2,en,in
Google Play,b57cc528-4d0b-4b37-b78a-f3d10a5d126b,Cute Babies videos,,Now days I book rides and driver cancels I book driver cnacels,1,0.0,2023-03-20 08:09:47,"This is definitely not the experience we wanted you to have, We have stringent guidelines to monitor ride cancellations. Request you to share the CRN of these instances at (m.me/olacabs) for us to look into this for you.",2023-03-28 19:30:53,,en,in
Google Play,2e015f7f-bcfa-49b2-9faa-2bd4f9d6485f,HABEEB UNNISA,,I had ride once the driver had not submit paid cashn since that long time i cant use ola they r asking to pay n customer service is vvv poor,1,0.0,2022-03-21 17:35:07,,,,en,in
Google Play,46a9acf0-7bee-41f6-b024-531ff1503b0a,RITIK AHIRWAR,,"This app and all the drivers associated with this company, all are cheaters. The drivers knowingly take long routes to increase the fare thinking the customers are fools, just like them. If you go to Ola's support section, these people support the drivers saying everything is charged correctly. Ola authority, if you are reading this, I want my ₹329 back which I have been charged extra till 27 Nov 2021 just because of drivers taking long routes.",1,0.0,2021-11-27 09:55:43,"We're upset by the troublesome experience you had with us, Ritik. Don't worry, we're always here to assist you. Kindly write to us at (m.me/olacabs) along with the CRN of the ride for us to investigate and assist you aptly.",2021-12-01 15:21:01,,en,in
Google Play,e9b18923-7eab-4697-9627-9deddcc7c4a5,A Google user,,"No response from helpdesk, my account got blocked can you tell me what is the reason",1,0.0,2018-04-02 23:32:13,,,4.5.8,en,in
Google Play,d7efd363-eed6-4992-9b75-3b4cd39eb484,Kshitiz Verma,,Bad experience,1,0.0,2021-11-14 04:51:16,"We never aim for such an experience, Kshitiz. Kindly elaborate on your concern at (m.me/olacabs) for us to check and assist you in a timely fashion.
",2021-11-14 12:04:37,5.5.5,en,in
Google Play,c30b0f5d-e913-4c4a-9b22-5256d7bd3b60,A Google user,,Pathetic service by Ola.,1,0.0,2018-09-20 05:46:23,,,4.7.1,en,in
Google Play,e6032031-54e9-4372-87e1-4f8395d2841f,A Google user,,Disgusting customer service i Deleted the app cz their driver took money from me for the ride and so did they. Mostly their drivers r rude n denies ur rides. The customer care will only give u automated calls for the first three months of ur dues so u cant even tell them about u being duped by their drivers. Overall they have the worst service. Try other apps way better than them.,1,0.0,2020-01-27 03:13:02,,,,en,in
Google Play,11a633e0-03e4-44b8-841e-a0eadb1dcc15,Shahnawaz Ali,,Third class service now i never book this third class service,1,0.0,2021-11-01 13:00:14,"This kind of review makes us super sad, Shahnawaz. We want to know the reason behind your dismay. Kindly elaborate your concern via (m.me/olacabs) for us to understand and assist you in the best way.",2021-11-02 11:51:25,5.5.2,en,in
Google Play,8b67961d-1ef3-479f-b1fd-ce4841e7a2fa,A Google user,,First Ola driver left me and my parents midway... I booked ola cab for 120km/12 hours... Ola driver left us midway after driving for 41km only and the reason he gave me that he dont have money for gas... I paid 2400rs online... 2nd time ola driver charged my parents more than the estimated money and left them again before the destination point in a new city. tried calling old customer care but no1 is picking my call since 2 days... so screw you ola...shifting to uber...u thieves,1,0.0,2019-06-18 16:16:33,,,4.9.1,en,in
Google Play,eabbe719-a8e9-401d-a58a-b447f45b530c,Nitin Kumar,,Worst app to use,1,0.0,2022-07-05 12:58:26,"Your review is concerning for us, Nitin. We're here to assist you in the best way. Kindly elaborate on your concern via (m.me/olacabs) for us to understand and assist you at the earliest.

",2022-07-13 07:41:26,5.7.2,en,in
Google Play,445dd8ad-3c44-44ca-b8aa-68e3fb79a31e,Edwin Matthews,,Cant able to use when in need,1,0.0,2022-01-19 03:29:12,"Your review is concerning for us, Edwin. We are here to assist you in the best way. Kindly elaborate on your concern via (m.me/olacabs) for us to understand and assist you at the earliest.
",2022-01-19 14:21:33,,en,in
Google Play,b216eb32-2805-4469-8ce3-792c0968c375,Dilip Katharotia,,"Since I have made 259rs payments of one of my ola rides in cash to the cab driver. Now, every day, they are enforcing me to pay again online, saying that you are unable to do the cash transaction to cab driver. Also added a penalty amount of rs 100 on it.",1,0.0,2023-06-30 07:19:30,"We're upset by the troublesome experience you had with us, Dilip. Please share the CRN of these instances with us at (m.me/olacabs) so that our team can assist you further.",2023-07-06 10:24:58,6.1.7,en,in
Google Play,8f120808-d960-4a2e-aa09-07a85c8acb4b,shubham Shukla,,Ek dam bakwas driver bar bar ride cancel krte hai charges hmare account se cut krte hai,1,0.0,2022-04-30 07:35:15,"Hello, Shubham. This is absolutely not the kind of experience we would like our customers to face. Kindly share the CRN via (m.me/olacabs) for us to investigate and take timely action against the driver-partner to ensure such instances are not repeated in the future.",2022-05-04 18:16:24,5.6.6,en,in
Google Play,955b3489-4add-4081-96b8-210e4eb09a75,A Google user,,Always shows 'GPS turned off' even though it's turned on. Hence I can't book rides.,1,0.0,2019-04-15 05:35:53,,,4.8.4,en,in
Google Play,e3dcc38a-04dc-43a0-9835-4b837b654d70,R U,,I am unable to get any ride in Panipat since 3-4 weeks. I got the ride only the first time i installed the app.,1,0.0,2021-12-07 03:04:51,,,5.5.7,en,in
Google Play,40f221d8-14c5-40d1-b63e-7c6ff00e4459,Vipul Bairagi,,Unable to download even I have 50mbps broadband connection.what a joke.,1,0.0,2021-07-31 05:46:24,,,,en,in
Google Play,a8ce5766-9f1a-4b6e-a8b3-47938a1a6434,A Google user,,"In my case both ola management and the car driver is cheated on me. Due to more trust on this application blindly, the driver had collected both my ola money and cash I.e (1056 +1060),when I tried to contact the driver he didn't answer my call. And after a complain in ola support they didn't support me.",1,10.0,2018-03-01 12:48:10,,,4.5.6,en,in
Google Play,1d03d061-6da5-42b2-9750-c2c706724fcb,A Google user,,Very bad condition for traveling charge,1,0.0,2019-11-04 00:21:00,,,5.0.1,en,in
Google Play,6dc20d4a-405f-4ec3-8f66-5846af61b5a9,studywith rahul1,,Very Bad App I have already 3 times paid 5 Rupees to Driver but again and again notification me 5 rupees dues.,1,1.0,2021-09-16 09:46:14,"We’re upset by the experience you’re facing with us. Please share your experience with us along with the ride CRN at (m.me/olacabs) so that we can investigate to ensure such instances are not repeated.
",2021-09-17 23:19:10,,en,in
Google Play,68fb92b7-9d52-43b8-9218-72ce37ee5e1e,A Google user,,"IT'S SO DIFFICULT TO BOOK AN OLA CABS .WHEN I WAS GETTING LATE THE, OLA CABS DRIVER MADE ME WAIT FOR AN HOUR THEN THE DRIVER SAID SORRY THAT I WILL NOT COME DUE TO SOME REASON . DUE TO THIS I GOT LATE FOR AN HOUR AND THEN ALSO OLA CANNOT PROVIDE ME WITH ANOTHER CAB DUE TO THIS I CANNOT CATCH TNE BUS.",1,1.0,2019-05-27 07:19:00,,,4.8.9,en,in
Google Play,79970849-a6c7-4880-9c32-92d4d1e92b77,El Commander,,Driver arrives 30 minutes after booking. Use uber be safe,1,0.0,2021-03-04 19:23:07,,,5.3.7,en,in
Google Play,d9c08f21-f74d-45ef-b8dd-772eca5d03d6,A Google user,,No response for short distance,1,0.0,2018-12-25 16:40:58,,,4.7.7,en,in
Google Play,f7beadab-95d9-4ed3-aa6c-1adae9593a7d,A Google user,,Loot,1,1.0,2019-11-19 17:58:09,,,4.9.9,en,in
Google Play,2f83edbd-80c0-47b2-9ba4-433173310cc2,Talib Ansari,,Drivers always deny to go somewher,1,0.0,2020-12-06 13:44:09,,,,en,in
Google Play,55dd96a5-224c-4ebd-a3d3-9a1b87b52d43,rakesh arji,,"One of the worst experience I have when it's urgent there will be no delivery patner assigned even if driver assigned no use he will accept the ride and will not come to pickup not lift the call and more over UBER,RAPIDO are so much better",1,0.0,2023-07-11 02:54:52,"We are concerned about the 1-star rating and would like to know the reason behind it, Rakesh. Kindly elaborate on your concern at (m.me/olacabs) post which our team will connect with you and assist you further on the same.",2023-07-10 20:55:27,6.2.4,en,in
Google Play,5920edcb-0199-42a2-be45-294e5455189d,A Google user,,Could book cab and no option to contact customer care. It's really annoying when really in need.,1,0.0,2019-11-15 02:04:41,,,5.0.2,en,in
Google Play,ce0e6c4b-e227-46ca-b651-b8bcf095e5c2,Riya Singh,,"Worst app. Even after the fault of the driver and the authorised party, we have to pay the fare and what about us. I got late twice because of their poor services. And because of that my two days salary was deducted recently. I tried to contact ola support. But they are unreachable. Now i want to talk the customer care services of ola through call. But there is no contact provided.",1,14.0,2021-07-12 03:47:46,"We are alarmed to hear this and we appreciate you bringing this to our notice, Riya. Please be assured that we have stringent guidelines against such unprofessional behaviour. Request you to share the CRN of the ride at (m.me/olacabs) so we can take corrective action against the driver and will make sure such instances are not repeated.
",2021-07-13 20:38:24,5.4.7,en,in
Google Play,cfff3f2c-61d2-4f6f-ae7d-fb0b2910949e,A Google user,,Smart app,1,0.0,2020-03-10 12:26:25,,,5.1.1,en,in
Google Play,0f152a76-787f-454e-9432-399719eec069,Manish Gulia,,Driver cancelled the ride,1,0.0,2023-07-24 03:23:14,"This isn’t something that we want our customers to face, Manish. Kindly share the CRN of the ride via (m.me/olacabs) for us to investigate and assist you at the earliest.",2023-07-26 09:57:25,,en,in
Google Play,f42f901a-6d69-4a0b-b3fe-c8fe6bc737fd,Mohd Shaid,,To bad,1,0.0,2022-06-05 13:10:49,"We never aim for such a kind of experience, Shaid. We wouldn't want you to feel this way. Kindly elaborate your concern at (m.me/olacabs) for us to check and assist you in a timely fashion.
",2022-06-14 10:27:37,5.6.9,en,in
Google Play,4d2aef6d-c252-4014-ac70-ec8bf21d0614,A Google user,,"I am not able to do my KYC for Ola Money... I have 12 MP front camera; still the app is not able to detect the image and it is very annoying as I have tried to put the selfie many times and still I am having a problem with completing it... Another problem is that I am trying to add the selfie from my Gallery but the ""Gallery"" option isn't supported when trying to do Step 3 as nothing happens when I am trying to click on that option. I hope the said issue is resolved ASAP",1,0.0,2019-02-10 10:55:11,,,4.7.9,en,in
Google Play,796618c6-6afb-4d3a-bad3-6cefc0a14d70,Ishani Macwan,,"Firstly, Ola dosen't make customers aware about incremental charges in the beginning itself. The drivers are not well trained on how to behave with customers. The worst experience ever. My entire knowing and I would never use ola again. Rude drivers, they should speak politely and not create a scene. The total bill amount was different then also he charged extra, was it legal? If yes then why don't ola mentions it in bill break up itself?",1,0.0,2023-02-20 04:37:23,"We want to make sure this is taken care of, Ishani and do understand how upsetting this might have been. Kindly share your concern along with the CRN of the ride via (m.me/olacabs) for us to investigate and assist you at the earliest.",2023-03-03 01:18:10,,en,in
Google Play,3940ba39-c5c6-4817-8648-566600fa0228,prabh singh,,It is very bad app not give services when a person is very needy very bad experience 😡😡🤬🤬🤬🤬🤬🤬🤬,1,0.0,2022-01-05 16:41:35,"We never aim for such an experience, Prabh. Kindly elaborate on your concern at (m.me/olacabs) for us to check and assist you in a timely fashion.",2022-01-06 12:15:18,,en,in
Google Play,47f90577-0921-46c0-8df0-f8292e92eb07,A Google user,,Worst app,1,0.0,2019-12-24 11:46:09,,,5.0.3,en,in
Google Play,91ad6b85-1827-4e86-9d3e-fbeafd40acc4,A Google user,,cabs take a long time to get booked and take 15 mins to reach location. Autos don't get booked at all no matter how much you try. worst app and gets me late to everywhere. UBER is better,1,0.0,2018-12-21 11:58:27,,,4.7.7,en,in
Google Play,22c804d3-c6ac-417c-af71-40e31454bf28,Soumi Goswami,,PATHETIC SERVICE. One damn of application. Useless!,1,0.0,2021-08-14 17:36:06,"This kind of a review makes us super sad, Soumi. We want to know the reason behind your dismay. Kindly elaborate your concern via (m.me/olacabs) for us to understand and assist you in the best way.
",2021-08-18 19:27:36,,en,in
Google Play,2aa2c5b8-5677-4783-953a-2de5de77a83d,Arastu Chattopadhyay,,Peak surcharge is the new scam that Ola is using to milk excess money from it's user ... For a estimated bill of 363 rupees I ended up paying 750 rupees of which 250 was surcharge fee. And with pathetic customer service where I got to speak with a executive after dozens of try. I was a regular customer. Now uninstalling this App. How can I raise this issue in consumer forum. Any help regarding this will be helpful.,1,0.0,2022-03-28 10:45:10,"We understand how annoying this could be, Arastu. Please elaborate on your concern at (m.me/olacabs) so that our team can look into this and assist you aptly.",2022-03-28 09:30:29,5.6.6,en,in
Google Play,1d111e9c-d9ef-4933-bd29-220bf5c1d7d8,A Google user,,worst app.. you will mostly never find any cabs and with god grace if you find any the driver would cancel it making you wait for 10 15 min. total waste of time.,1,0.0,2019-06-12 08:08:08,,,4.6.7,en,in
Google Play,8a9c0d9f-fe98-4915-9a8c-05320098c487,A Google user,,"Absolutely hopeless, just get an uber.",1,0.0,2018-10-27 15:40:27,,,4.7.3,en,in
Google Play,70525171-dfc0-452c-9aed-1ca194d4d90f,Priya Narayan,,U have stopped my services.iwant to know the reason,1,0.0,2021-10-24 16:55:31,"Customer satisfaction is of utmost importance to us and we at Ola strive for it, Priya. We request you to elaborate on your concern at (m.me/olacabs) so that our team can investigate further and resolve it.
",2021-09-16 18:28:05,4.6.3,en,in
Google Play,070ee5a4-9e68-4437-bf91-3fb262f9d45b,Prayushi Rana,,This application always charges more than what it shows without waiting charges or luggage. Moreover it charges the customer even if the driver cancels the ride . Ola is ridiculous. Many of the time I cannot even find the ride and need to wait too long and expects the customer to pay for driver's waiting charge .,1,0.0,2021-09-20 07:08:49,"We understand the displeasure, Prayushi. Kindly elaborate on your concern at (m.me/olacabs) so that our team can assist you with this at the earliest.
",2021-09-24 14:01:44,,en,in
Google Play,9cbfff3c-a913-4c0c-b76a-7825ed0d729d,Radhika Ramesh,,It was very good and excellent once upon a time but now it's totally opposite driver is just urguing and forming a community for drivers like politics 😡😡😡I'm totally disappointed so uninstalled and decided not to use . Worst experience ever meet in my life and also extra payment.if there is an option for 0 rating I would go with that,1,0.0,2022-02-25 02:08:20,,,5.1.7,en,in
Google Play,a23cdceb-f3f6-41a0-a7f6-514dea6e0f0d,mitesh khambhaita,,Useless service not useful when require auto,1,0.0,2022-05-07 16:44:19,"Your review is concerning for us, Mitesh. We're here to assist you in the best way. Kindly elaborate on your concern via (m.me/olacabs) for us to understand and assist you at the earliest.",2022-05-12 05:39:29,5.6.7,en,in
Google Play,f8230acd-b225-47d7-83fd-9b89301d1473,Reecha Ups,,"This app, it's service providers and customers care has fallen to a New Low in terms of professionalism, culture appropriateness and basic human values. Drivers will pressurize for more money than what is prescribed by the app. They will reach near the location but not at the location and charge extra waiting charges. Moreover what ruins whole experience is that the driver may keep u waiting without arriving or cancelling the trip even after accepting it. Does not deserve a single star.",1,0.0,2022-05-10 14:41:45,"We're upset by the troublesome experience you had with us. Don't worry, we're always here to assist you. Kindly write to us at (m.me/olacabs) along with the CRN of the ride for us to investigate and assist you aptly.
",2022-05-15 08:14:52,5.0.2,en,in
Google Play,846e80f9-37e3-4420-9d63-9242b26461cf,Devesh Raturi,,Not good app,1,0.0,2020-10-17 08:24:30,,,5.2.8,en,in
Google Play,0a2f63d5-9744-4128-8f92-7618cf79abb3,A Google user,,Pathetic service.. Pathetic drivers.......,1,0.0,2020-02-05 12:28:29,,,5.0.9,en,in
Google Play,5681c5ff-e91b-44ad-bbcb-96709df8208c,A Google user,,I booked an auto. but the driver was not picking the call so I cancelled it and booked another auto.. but the next time I booked a ride they took the cancellation fee when. it was not even my mistake and I now am able to contact them now for this issue. not going to use this app again,1,10.0,2019-04-27 10:36:58,,,4.8.6,en,in
Google Play,e79f52b5-af8f-48d9-8bdb-ff00967aca3f,A Google user,,Ola is hiring criminal drivers. They have hired a driver jay prakash kushwaha in Allahabad city. He is a criminal shows guns when you sits in his car. Takes all money and asks you to go out. I am going to consumer court to take legal actions,1,0.0,2019-12-01 04:33:36,,,5.0.1,en,in
Google Play,6236f33b-e187-4518-86fa-f034b6417800,Merlin Mathew,,"Extremely pathetic. It was good until they began the Postpaid services. The postpaid service got initiated on its own and has been paying money online to the drivers after every ride. Not only that I have to listen to the curses and rants of the drivers for paying money online, first two times I paid 441/- and 71/- in cash to drivers not knowing postpaid was already activated. And now I am being charged the same amount. I raised a complaint, however no one ever contacted me.",1,0.0,2020-12-25 10:53:31,,,5.3.4,en,in
Google Play,4113a0af-d513-4c4d-8839-eba4bf05489b,A Google user,,Bad experiance many time,1,0.0,2019-04-16 06:50:50,,,4.7.6,en,in
Google Play,631a7fce-94fc-49f2-80e0-f39e25ce9e8c,Ar. S P Kushwaha,,To locate destination is a big task in this new updated version. Please make it easy so that people can drop the pin exact where they have to go and enjoy the trip without tension.,1,1.0,2020-10-18 15:54:47,,,5.2.6,en,in
Google Play,65d03c60-96da-495c-b070-6334ca471323,Biprajit Singha,,"In Guwahati, the condition of ola is worst. Ola is going to be replaced due to it's drivers.",1,0.0,2021-10-16 10:25:12,"We are concerned after looking at your review, Biprajit. Kindly elaborate on your concern at (m.me/olacabs) post which our team will connect with you and assist you further on the same.",2021-10-18 11:33:54,5.5.3,en,in
Google Play,c3d07bb2-5c14-4a45-ba1c-2219b6e2a81b,Vivek Aggarwal,,Everytime I book a ride it cancels. Don't book Ola..,1,0.0,2020-11-03 08:41:27,,,4.7.7,en,in
Google Play,a7fe2e6a-e3fb-43e3-a2ae-99328bc5313b,Mohammed Imran,,Worst service drivers are not accepting ola requests,1,0.0,2022-03-21 04:48:19,,,,en,in
