source,review_id,user_name,review_title,review_description,rating,thumbs_up,review_date,developer_response,developer_response_date,appVersion,laguage_code,country_code
Google Play,e4a2c377-c8b1-4c62-aaca-67934bfe76e8,A Google user,,Cancellation charges was horrible shift to uber,1,0.0,2018-03-21 06:59:20,,,,en,in
Google Play,7b513c3a-fad0-4da8-b5e1-7cce49e8278a,Shruti Garg,,Worst app ever kasam se..they always cancel booking at very last moment (genuinely guys always),1,0.0,2022-05-09 16:40:32,"We're upset by the troublesome experience you had with us, Shruti. Please share the CRN of these instances with us at (m.me/olacabs) so that our team can assist you further.",2022-05-13 07:03:20,5.6.7,en,in
Google Play,c09339cf-2622-4ddc-8b3d-cfc70d54034e,Komal Tyagi,,"Very pathetic service of ola, no driver available near location on time, if any driver accept they cancel the drive after few minutes",1,0.0,2020-12-01 06:08:57,,,5.3.2,en,in
Google Play,4be8f69d-a35e-4873-aba2-e0d04bcf5e63,michael simon,,Im totally disppaointed.....i booked a ride and total KM driven was 88 ...but i was charges for 113 km....when i contacted OLA support they mentioned they have asked with Driver and driver said he had drived 113 km itseems..so they cant help me...im sooooo unhappy....really if any of you can help me...pleaee call me or support me...or better use UBER instead of getting high rate in OLA,1,0.0,2021-04-21 07:39:21,"Hi Michael, we apologize for the inconvenience. We request that you share your booking details at (m.me/olacabs) and we will definitely look into it.",2021-04-21 11:23:23,,en,in
Google Play,dc8d083a-bd17-45d7-8177-03331ee83948,A Google user,,Very bed,1,0.0,2018-11-11 13:04:45,,,,en,in
Google Play,1fca7f9a-2aa2-4aab-9600-ec3592432203,Sukhdev Bhatt,,Debit money from wallet and also drive is taking cash payment,1,0.0,2023-07-18 07:26:31,"This is certainly not the experience we want for you, Sukhdev. Kindly share the CRN of the specific ride via (m.me/olacabs) for us to investigate and assist you aptly.",2023-07-20 09:11:45,,en,in
Google Play,75bdc07c-cac5-483d-8a0d-82c161df45ee,A Google user,,"very much disappointed with ola, i am living in Chennai, ola auto's are not at all available here. whenever we open the app it shows 1min away. but not even a single a auto comes, by mistake any auto is booked they are cancelling the ride and we have to look for another one.",1,0.0,2019-10-02 08:01:28,,,4.8.1,en,in
Google Play,1fd14206-5bc4-418d-8607-95ca5aa8e9a4,A Google user,,worst experience with ola drivers multiple times and one guy threatened for paying through ola money and he used abusive language. The other worst thing is customer support by ola. i was not able to reach ola support team at all,1,0.0,2019-05-10 13:26:41,,,4.8.7,en,in
Google Play,95058f92-a979-40b1-bf3d-2281637feedf,A Google user,,App doesn't start and keeps crashing. Worked on old Phone. Won't even open on Resmi K20 Pro.,1,0.0,2020-03-09 15:53:22,,,,en,in
Google Play,a1a5ae55-98b9-4ee0-9a40-34ef40d9d48f,A Google user,,"The auto drivers are indicent behaving. First tell them how to behave with 
customers. Worst experience many times",1,0.0,2018-06-08 10:30:14,,,,en,in
Google Play,896f1bac-9bab-457c-a92f-94bb5b1c76f6,Shashi Kant,,Worst experience...,1,0.0,2023-02-13 06:07:03,"This kind of review makes us super sad, Shashi. We want to know the reason behind your dismay. Kindly elaborate on your concern via (m.me/olacabs) for us to understand and assist you in the best way.",2023-02-13 19:14:04,6.1.3,en,in
Google Play,a696c7df-6f93-4085-9a67-292cfd7f30fb,Archana S G R,,Worst experience I haven't cancelled my booking first time I Booked my ride they charged 50Rs cancellation charges plus and extra 10 rupees I have paid to driver still it's showing 10Rs pending in application disgusting,1,0.0,2021-07-06 07:27:01,"This is certainly not the experience we want for you, Archana. Kindly share the CRN of the specific ride via (m.me/olacabs) for us to investigate and assist you aptly.
",2021-07-06 21:38:10,5.4.7,en,in
Google Play,0466f99c-f9e6-438c-9d2d-cac85e17130e,A Google user,,"App shown 466 but charged 618. Totally unfair as for 29 km in just 45 min. 
Even waiting for 20 minutes for pickup. Delay in pickup charged by me. Chor 
company pls do not download this app as it is a chor company",1,1.0,2018-04-29 18:26:48,,,4.5.9,en,in
App Store,7420c658-86c9-4599-95cd-c943125e25a1,Jay1ram2,Non existent customer support,"Created a new ola account and tried to book my first ride. To my surprise, it said that I owed more than Rs.2000 which I need to pay before my first ride. I was surprised by this as I have never taken a ride using this account. 

I tried to reach their customer service via phone and realized they offer support only via email. So, I sent an email explaining my problem from my registered email. 

All I got is a generic email response  “We see that you have written to us from the unregistered email ID. Please write to us from the registered email ID” which is completely wrong. I indeed sent the email via my registered email address. 

It has been 2 days since I sent a follow up response with a screenshot of my account with phone number and registered email address. However, I am yet to get a response.

OLA service seem to have fallen to the rock bottom since the glory days (before covid)",1,,2022-06-09 09:49:06,"{'id': 31914464, 'body': ""Hi Jay, we're alarmed looking at your review. We're here to assist and make things right for you. Kindly share your concern along with your registered contact details via (m.me/olacabs) for us to get it checked for you. \n"", 'modified': '2022-09-08T15:10:43Z'}",,,en,in
Google Play,7037dba0-7bb2-461a-9d8a-c564750fe90c,Basang Gaming,,Always showing technical issues in ola money..,1,0.0,2021-11-26 10:13:48,"We understand your displeasure. Please try re-installing the app and check if it works. If the issue persists, kindly write to us at (m.me/olacabs) and we will reach out to you for further assistance.",2021-11-27 13:16:38,5.5.7,en,in
Google Play,bf7c0ac9-c0f5-4dba-ae84-0c00b5468751,Manoj Yadav,,faltu aap for cab booking when we are booking ola cab price always increase min by min people are not fool if we got best price deal they never accept the ride and there should proper price management,1,0.0,2022-04-01 10:33:28,"Namaste Manoj, hum samajhana chaahate hain ki aap aisa kyu mahasoos karte hai. Kripaya (m.me/olacabs) ke maadhyam se apni samshya humse share karne taaki hum aapaki uchit sahaayata kar sake.
",2022-04-01 10:18:18,5.6.6,en,in
Google Play,0af8794e-fde6-47d6-8b5d-9875f6f8656c,Satyanand Gupta,,"Pathetic drivers and lack of professionalism because of delayed payments to driver partners, they always ask for cash payments or they cancel the trips. I was with my family so I paid the driver in cash, now OLA app is asking me to pay bill in chunk of 50 rupees, don't know if it's some tech glitch in the app or what! I paid two times 50 rupees each time, but it still asks me to clear dues of 386 and on clicking the Pay button it asks to pay 50 rupees everytime. Complained twice but of no use.",1,0.0,2021-10-27 08:28:48,"We understand the displeasure you are facing with us, Satyanand. Kindly share the CRN of the specific ride via (m.me/olacabs) for us to investigate and assist you aptly.
",2021-10-28 18:56:23,5.5.5,en,in
Google Play,f0d2f63c-8a76-4852-89bb-1f85161af909,A Google user,,worst customer support i have ever seen. i wish i can anle to give Negative rating via stars,1,0.0,2019-08-03 11:22:51,,,4.9.3,en,in
Google Play,8ecb0be8-e1f0-4930-9c01-1c0d5588aac8,SAINUL HAQUE,,Its very bad,1,0.0,2021-01-20 07:32:19,,,5.3.5,en,in
Google Play,096f911e-48d2-40a0-a8bd-4accdb0efef9,Neel Shinde,,Nakali,1,0.0,2020-12-16 12:46:25,,,5.3.3,en,in
Google Play,a9bfd0c9-a759-46b7-a86e-fd8c0060bf98,Nisha Yadav,,Vehicle Number PB01C0987 Name Jaibhagwan This person is fraud Usually company is fraud. Ye pese le lete hai extra. Is company ke driver logo ke sath fraud karte hai ladkiyo ko chedte hai. Misbehave karte hai. Sabse jyada fraud is bande ne kiya hai Vehicle Number PB01C0987 Name Jaibhagwan Isne bhut logo ke sath fraud kiya hai Ola wale ko complaint karo to wo kehte hai ek do bande ki aur complaint ayegi tab dekhenge Fraud Fraud Fraud Vehicle Number PB01C0987 Name Jaibhagwan,1,0.0,2020-09-19 06:40:22,,,,en,in
Google Play,8295cc31-c47f-43d2-b9c4-b74dcd82831e,A Google user,,Drivers r pathetic app shows estimated time two min driver says 20 min,1,0.0,2018-03-18 08:53:28,,,4.5.7,en,in
Google Play,47dba5ba-c448-45e9-a134-85f2d102730f,RAGHUNATH SETHI,,"Very greedy and cheater drivers are here . Booked ola bike it was showing ₹54 and after reaching destination it was ₹80. The driver took a very long route even after my requesting he didn't took right route due to which I reached 20 mins late than usual. Driver's behaivour was rude , he even asked extra money during ride. Ola should take strict actions towards these type of drivers.",1,0.0,2021-12-23 09:51:45,"We understand how upsetting it may have been for you, Raghunath. This is definitely not the experience we wanted you to have. Request you to please share the CRN of the ride with us at (m.me/olacabs) so that our team can assist you further.",2021-12-23 14:59:10,5.5.5,en,in
Google Play,b5f0cddb-1ff9-414a-8053-cb37843bc942,Kishore Dait,,Charged higer than booking,1,0.0,2022-12-19 04:14:23,"We'd never want any of our customers to have such a perception about us, Kishor. We request you to elaborate on your concern at (m.me/olacabs) so that our team can investigate further and resolve it.",2022-12-21 12:28:24,5.8.1,en,in
Google Play,fab0df49-0cea-4d55-9c3e-0f906c10ec87,Anoop singh,,"Now i believe Ola is not capable to manage their services. Ola auto is too bad service. Specially when you need most. What pathatic service, we book cab with proper destination and driver denied over the call that they will not go to the direction. What kind of service it is, if we need to complain there is not direct no available. That is disgusting...😠😠😠",1,1.0,2022-06-20 02:51:25,"We are alarmed to hear this and we appreciate you bringing this to our notice, Anoop. We have stringent guidelines against such unprofessional behaviour. Request you to share the CRN of the ride at (m.me/olacabs) so we can take corrective action against the driver-partner and will make sure such instances are not repeated.
",2021-08-20 13:26:31,5.6.9,en,in
Google Play,7bdb149f-2935-46dd-8239-3de130cd5aad,Math Guru,,"Worst customer service. These bastards . Don't do , any background check of thier so called useless driver partner. I had worst response. They are least bothered about thier customers. I request. No one to use ola service. They cancel rides also. Even after waiting hours. I reported . Ola postpaid amount debited again. That he snatched my mobile and gave 5 star rating and also he robbed 500 ruppes by cash. He was kept on playing loud music at 2am. On 17-10-2022. He has lied ola fellows.",1,0.0,2022-10-25 14:45:39,We understand how upsetting it may have been for you. This is definitely not the experience we wanted you to have. Request you to share the CRN of the ride with us at (m.me/olacabs) so that our team can assist you further.,2022-11-14 20:39:43,5.7.5,en,in
Google Play,0e2bc8be-ab82-4dfe-b826-f7fcfeb562b5,Makar Dhwaj Gupta,,"Not able to add amex card, don't know what is corporate profile means and get failure message on click",1,0.0,2023-06-03 08:52:43,"We want to make things right for you, Makar. Please elaborate on your concern at (m.me/olacabs) for us to check and assist you in a timely fashion.",2023-06-12 23:03:51,6.2.1,en,in
Google Play,f3d5e085-a558-4e81-976a-f9d4dd833100,kishan sindhe,,After ride amount charged is double the amount shown during booking. Support button ends up in error. Call us button points to invalid number.,1,108.0,2022-09-08 03:15:18,"We're upset by the troublesome experience you had with us, Kishan. Please share the CRN of these instances with us at (m.me/olacabs) so that our team can assist you further.",2022-09-04 09:36:57,5.5.5,en,in
Google Play,c51252f2-7dd2-462d-9d5b-4e9cecb3ebdb,Zabiullah Inayath Basha,,Very negligence drivers didn't expected from the brand there so no any other way to get in touch with the support team over the aap,1,0.0,2021-01-06 14:33:52,,,5.3.5,en,in
Google Play,d181613b-09f5-4a98-810e-1e106bc8ec52,Atharva Mathur,,"Now the facility of ola is not good as cap driver, auto drivers are very they speak very abusive language and they are very rude by there nature very poor service shame on you ola",1,0.0,2022-05-07 15:30:29,"We are alarmed to hear this and we appreciate you bringing this to our notice, Atharva. We have stringent guidelines against such unprofessional behaviour. Request you to share the CRN of the ride at (m.me/olacabs) so we can take corrective action against the driver and will make sure such instances are not repeated.
",2022-05-12 03:03:53,5.6.7,en,in
Google Play,3ea76370-9621-4f43-91a1-95055e3fd97a,A Google user,,Manners less drivers. Who don't know how to talk customers.,1,0.0,2018-04-23 18:01:42,,,4.5.1,en,in
Google Play,cc463184-6753-41de-9df8-fa105ea93094,A Google user,,Worst customer support....,1,0.0,2019-03-09 18:13:37,,,4.8.2,en,in
Google Play,bd5603fd-bf5f-4f68-abf7-477cfef72d50,A Google user,,Worst experience of my life I can't anyone officially They are charging me for a post paid ride which hasn't been completed even ended have end up at starting position Very poor,1,0.0,2019-11-05 02:38:06,,,5.0.1,en,in
Google Play,ec1967b1-f3be-4758-9582-94167f3df9a0,Sambhav Aditya Garg,,Prices are not trustable...In case of rentals even if total amount is shown Suppose 2646/- and km and timings both are left then also they charge lot of money. They charged 3018/- They are cheaters,1,0.0,2022-03-17 15:35:53,,,5.6.5,en,in
Google Play,5a910971-9f48-4498-9939-0f7e8307972e,sayed ali,,Very poor service before booking showing one amount and after completing the trip showing other amount they chare me more then 1000 exter i hate this app n service,1,0.0,2020-11-24 11:06:30,,,5.3.2,en,in
Google Play,ce203eb4-fbd5-449b-a8e9-f76a409e9806,Rajesh Jha,,Very Bad Service by Ola team no reply on mail it should be banned by our government. Irresponsible or illetrate people hired in Ola team,1,0.0,2023-07-09 06:48:32,"We are concerned after looking at your review, Rajesh. Kindly elaborate on your concern at (m.me/olacabs) post which our team will connect with you and assist you further on the same.",2023-07-11 08:35:01,6.2.4,en,in
Google Play,59a8a7dc-cf78-449e-99e6-94a8881c92ef,A Google user,,Not at all user friendly,1,0.0,2019-10-26 01:55:55,,,5.0.1,en,in
Google Play,bfd20c3a-d482-4f8a-a25a-ec2b8b6ee6d1,satya srikanth,,Bakwas app does not any request to reach customer care ...by mistake paid amount by cash and later forced to pay online now iam not able to reach customer care or not even able to write mail,1,0.0,2021-06-18 10:24:23,"We apologies for the hassle caused to you, Satya. Kindly share the ride CRN via (m.me/olacabs) so that our team can check and assist you at the earliest.",2021-06-18 17:42:22,5.4.6,en,in
Google Play,711745d3-dd62-4bb7-a1b8-b001cafee10b,Saksham Ak,,"Worst experience ever... Ordered a bike ride and he didn't even saw where to drop me and accepted it and after wasting my 1 hour he called me and asked me to cancel the ride. When I again called the bike ride, he said he will reach in half an hour and 1 hour passed and no response and even the incoming on that mobile number was not available and hence I was not even able to contact him.....",1,0.0,2021-03-17 13:51:55,"Hi Albela, we are sorry to hear about the the trouble you've had with the driver-partner. Please write to us at (m.me/olacabs) with more details. We'll get to the bottom of this and assist you soon.

",2021-03-17 14:05:24,5.3.8,en,in
Google Play,47ae3975-b52a-49e6-9d89-359675da97fc,nidhi palecha,,Ola drivers are very rude and asking for extra charges. Even after raising this issue in app. No action taken against drivers. Ticket are getting resolved without any proper solution. Kindly look into this.,1,3.0,2022-02-04 02:03:53,This is definitely not the experience we wanted you to have Nidhi. We have stringent guidelines against such behaviour. Request you to share the ride CRN of this instance at (m.me/olacabs) for us to look into this for you.,2022-02-05 19:58:00,5.6.3,en,in
Google Play,39a61dcb-62ca-45af-8544-c0a121123e5b,A Google user,,App doesn't work on my cell phone when used on data. It works when connected to Wi-Fi. I waited a long time and for many updates but finally gave up. Please look into this matter and if possible provide a solution so that the app starts working on my one plus 3 phone. My network is airtel FYI.,1,0.0,2019-12-18 11:32:36,,,4.8.8,en,in
Google Play,b623a436-3062-4d3e-8600-cfa80297495e,A Google user,,codam,1,0.0,2019-06-09 07:32:58,,,4.9.1,en,in
Google Play,1cd513cc-66bb-4821-99d8-4f5e2a620e9a,ibrahim Nur warsame,,Ola is very bad when it come to dealing with the customers. I had a very bad experience while using this app. I requested a ride then been cancelled twice in u under 5 minutes. I tried to sort this out by contacting Ola customer service but they told me that they only help their drivers not the riders which is very bad compared to uber. I also did some feedback on the app but no one come back to me or send email to me. If no one sort out this issue I will switch using other Ride shares.,1,0.0,2020-10-01 02:13:49,,,5.2.6,en,in
Google Play,cce03fc7-0383-4d87-81fd-c6e637019494,rajesh banoth,,"Can't trust on OLA now,Drivers cancelling trips even after 5 min of allotment. It takes atleast 5 cancellations and more than 1 hr to get a successful ride.",1,0.0,2022-04-14 05:27:38,"We're upset by the troublesome experience you had with us, Rajesh. Don't worry, we're always here to assist you. Kindly write to us at (m.me/olacabs) along with the CRN of the ride for us to investigate and assist you aptly.",2022-04-21 00:52:15,5.6.6,en,in
Google Play,4b90b782-f5f4-4e44-b239-f442fd187b71,A Google user,,bikes are not booked properly,1,0.0,2019-06-16 13:54:20,,,4.9.1,en,in
Google Play,c7f171a6-7d17-4d3e-bf62-9345708411dd,A Google user,,Worst app they charge more than the estimate charge,1,0.0,2019-08-17 06:25:23,,,4.8.6,en,in
Google Play,04288fde-0892-410c-8ec9-c9e8e6d5e902,SAIPRASAD,,No auto in main road,1,0.0,2021-07-05 13:30:27,,,5.4.7,en,in
Google Play,13bcfbf5-bdbe-4755-9f97-2a0b84069080,mohit mohit,,no good,1,0.0,2020-12-26 17:25:33,,,,en,in
Google Play,39f2425a-632a-4e30-9d50-5e9cb79b0152,Rishabh Verma,,🤮🤮🤮🤮🤮🤮Worst service ever.. there driver deny duty..and after three cancellation ola block the account . They dont deserve 1 star also... 🤮🤮🤮🤮🤮🤮🤮,1,0.0,2021-08-03 03:15:33,"We're saddened by the troublesome experience you had with us. Don't worry, we're always here to assist you, Rishabh. Kindly write to us at (m.me/olacabs) along with the CRN of the ride for us to investigate and assist you aptly.
",2021-08-07 12:59:24,5.4.9,en,in
Google Play,6f66c275-b156-4bc6-abff-afb5febb4d26,Rajasekar A,,"Worst service and no reply from support for mails. Also, the app does not have support for payment related issues. I am repeatedly getting payment due mails and messages. Actually, I have paid the full amount to the driver in cash as per his request, and Rs. 20 has been detected from my ola money as well. But still, I am getting payment pending messages. Now, my bookings have also been blocked.",1,0.0,2022-12-19 04:28:48,"This is definitely not the experience we wanted you to have, Rajasekar Request you to share the ride CRN of these instances at (m.me/olacabs) for us to look into this for you.",2022-12-21 12:33:13,5.5.7,en,in
Google Play,fd0e3c4f-f23d-4221-8cae-ce8ab4091cc7,CIVIL GUIDE,,There is some technical issue going on the app. It's showing some technical glitch,1,0.0,2022-06-29 06:29:55,"This seems to be a technical glitch. Do not worry, we're here to assist you. Kindly update the application and if the issue still persists, write to us at (m.me/ olacabs) so that we can look into the concern and make things right for you.",2022-06-03 21:26:59,5.6.9,en,in
Google Play,e2ac5cbc-6398-4026-99ec-60a0ff76b41c,Vijay Prasad,,Nobody is accepting..,1,0.0,2022-06-06 06:32:13,"We're upset by the troublesome experience you had with us, Vijay. Please share the CRN of these instances with us at (m.me/olacabs) so that our team can assist you further.",2022-06-14 20:25:20,5.6.9,en,in
Google Play,8bcfdd78-033f-4bb2-a2df-50d49d734508,SHARATH CHANDHAN,,"This is regarding Ola Electric, it's nothing but a fraud company. The scooter is full of flaws and just on Day-3 of my scooter it stopped working. Doesn't turn on at all. And it's been 15 days now and their customer care is just a bulls**t. My money went into gutter. Don't buy ola electric and lose your money. Instead go for known brands such as Ather or TVS",1,0.0,2022-04-18 03:54:03,,,5.6.6,en,in
Google Play,09304ab1-97a5-4722-b357-f7f9055628b1,T Sodhatar,,Drivers always cancel the rides. Specially in shela area of Ahmedabad,1,0.0,2021-02-17 11:47:45,,,5.3.6,en,in
Google Play,baf69899-bc5b-4c79-ae40-1562d60ea13b,A Google user,,"You will never get a ride.. if by chance you get one the driver will cancel it.. also don't ever go for pass coz as I mentioned earlier, you will not get a ride and you will end up losing your pass money also",1,0.0,2019-08-26 11:06:26,,,4.9.3,en,in
Google Play,96ee45b4-6a95-4355-8dcc-0bbd7648d25b,Deepak Sinha,,Facing login issues with my number and I am unable to contact them.,1,0.0,2021-09-16 05:09:40,"This seems to be a technical glitch. Do not worry, we're here to assist you, Deepak. Kindly write to us at (m.me/ olacabs) so that we can look into the concern and make things right for you.
",2021-09-18 18:34:22,5.5.2,en,in
Google Play,c42881a9-6213-48ea-af60-c12189d8c3eb,A Google user,,Uninstalled OLA App as they Activated the OLA credit facility without taking my consent and their tele callers are harassing me for making the due payment.,1,0.0,2019-09-21 09:55:25,,,,en,in
Google Play,a560a24d-aeed-4290-b62b-97fd1ab3b95e,NAZEEM SHA,,I book ola bike I show me 40 rupees know competing the ride its show Me rs 103 what the problem😠😠😠😠😠😠 not responsibility my call ola customer care,1,0.0,2020-09-26 17:44:20,,,5.2.6,en,in
Google Play,759f6e3f-ae48-4561-9efb-7eeba6c0ff28,Anish Mohanty,,Worst experience I had booked a cab then I paid cash to that driver and still pending payment is showing in my account and Ola customer is not clearing,1,0.0,2023-01-20 09:59:23,"We understand your displeasure and are here to address your concern, Anish. Please share your contact details and registered email ID via (m.me/olacabs) so that we can look into this and assist you further.
",2023-01-25 18:09:31,5.7.5,en,in
Google Play,eda2d183-5295-4e09-bcd3-59d80c5d35f1,A Google user,,waste one..onky in cities like chennai it may useful..in kovai the driver asking 10 to 20 rupees above on meter..is this good business? chi in vellore no auto..wasted time.,1,0.0,2019-03-10 07:29:10,,,4.8.2,en,in
Google Play,10318b62-f1d6-4b43-8547-425ce4c5a64b,A Google user,,Very worst app. It taking longer time than physically booking cab. ( e service ke nam par kalank he ola app. ) Very worst service..,1,0.0,2019-08-24 17:30:45,,,4.8.5,en,in
Google Play,c13cd54e-0f56-4784-b091-7c8e34b590ca,A Google user,,Why do you have to give an option to pay through Google pay if the driver has to claim the money once again? And your support is horrible. I had to pay the driver again and complained the same on OLA. It said the cash is added to my OLA money. Nothing was added. Horrible app.,1,3.0,2020-01-03 08:05:50,,,5.0.5,en,in
Google Play,281365f2-9a1f-4ed0-a121-0bb471f02ff0,A J,,You'll do not provide a msg saying not serviceable in the area. None of your drivers fulfil the ride request and keep cancelling. Mention not serviceable so I don't waste my time with your app and service.,1,0.0,2021-12-16 03:58:44,"We understand the displeasure you are facing with us. Kindly share the CRN of the specific ride via (m.me/olacabs) for us to investigate and assist you aptly.
",2021-12-16 06:49:42,5.5.5,en,in
Google Play,6626b8f7-8fa7-4dc4-bfce-c808b5dc2b7b,Priyanka Prajapati,,Worse service they are providing.,1,0.0,2022-09-15 12:16:48,"It’s always a pleasure for us to serve our customers, Harish. Keep choosing Ola Cabs in the future as we're eager to serve you again. Safe Travels! :)",2022-09-25 11:14:24,5.7.4,en,in
Google Play,27347242-d638-4493-b470-ee0246847011,A Google user,,"i booked ola cab on dated 27 june, driver ashok kumar with wihte dizer firstly, after so many calls he picked my phone.. he told me i am coming, i wait appx 20 min then i call him after 2 call phone was switch off, then i cancel ride.. today i booked another ola cab extra Rs50. had charged by ola.. its not good.. it was not my foult. refund my 50 rs..",1,0.0,2019-07-02 13:05:05,,,4.9.1,en,in
Google Play,25d86898-518d-467e-878d-651807b45237,A Google user,,worst servie. they blaming me that i abused without any reson and blocjed my account whithout any valid reson.. i suggest not to download this worst app...😡😡🤬🤬,1,0.0,2020-03-01 08:25:33,,,5.0.11,en,in
Google Play,9d216e31-6f6b-4152-a8f7-c695e678f217,A Google user,,worst app,1,0.0,2019-02-10 21:05:43,,,4.7.9,en,in
Google Play,dfa2a184-c285-4823-874e-cc6536edd6f8,A Google user,,Help option not functioning nor any contact option available in the app and operation of this app is not users friendly and does not address the concern of users.,1,1.0,2020-03-05 03:57:15,,,,en,in
